{
  "format_version": 0,
  "id": "pow.devnet-genesis-001",
  "kind": "pow_preimage_target",
  "status": "independently_verified",
  "description": "Mined devnet genesis PoW derive-key digest and inclusive target comparison.",
  "spec_refs": ["docs/pow-v0.md#1-pow-function", "docs/pow-v0.md#2-target-representation-and-comparison"],
  "inputs": {
    "context_ascii": "OUT Consensus v0 2026-08-30 proof of work header",
    "header_hex": "000000fb2651b3fba992e8836d846280745eb7a21d4962d4306858bbfb42690bde49c400000003baa26e3bdda0a7b3196e89367f32a9d05558ea5ea196875f30880f055e5226a700000000000000000000000000000000000000000000000000000000000000000000000000000000000000006a937280000fffffffffffffffffffffffffffffffffffffffffffffffffffffffffffffda2fb959f81d652879472f8c56076e63a2fb3587dda94754f316328e7ec431403d30a2588a2f688edd9b29af2bb3b522db2deb731709dbfb53fadefab69c21470000000000000ac5",
    "network": "devnet",
    "target_hex": "000fffffffffffffffffffffffffffffffffffffffffffffffffffffffffffff",
    "comparison": "pow_value <= target"
  },
  "expected": {
    "pow_preimage_hex": {"encoding": "hex", "value": "000000fb2651b3fba992e8836d846280745eb7a21d4962d4306858bbfb42690bde49c400000003baa26e3bdda0a7b3196e89367f32a9d05558ea5ea196875f30880f055e5226a700000000000000000000000000000000000000000000000000000000000000000000000000000000000000006a937280000fffffffffffffffffffffffffffffffffffffffffffffffffffffffffffffda2fb959f81d652879472f8c56076e63a2fb3587dda94754f316328e7ec431403d30a2588a2f688edd9b29af2bb3b522db2deb731709dbfb53fadefab69c21470000000000000ac5", "verification": "independently_verified"},
    "pow_hash_hex": {"encoding": "hex", "value": "00089b59cde9abecc6421d2cfd06f2abcba5c07dfcb9f3ab1c62e7c22b6b71c5", "verification": "independently_verified"},
    "pow_value_decimal": {"encoding": "decimal_string", "value": "15206968322379693611700189659404493744139692652470389352011176575471677893", "verification": "independently_verified"},
    "accepted": {"encoding": "boolean", "value": true, "verification": "independently_verified"},
    "work_decimal": {"encoding": "decimal_string", "value": "4096", "verification": "independently_verified"}
  },
  "verification": {
    "method": "C mined nonce 2757; dependency-free Python recomputed identical header, digest, comparison, work, and block ID.",
    "implementations": [
      {"name": "out_ref.py", "language": "Python", "version": "sha256:b9874f21ebf3ef727e7733c1dff5d33f5da2239e73fafdf86eb6f85b631cdf73", "result_digest": null},
      {"name": "out_ref.c plus official BLAKE3 C", "language": "C", "version": "wrapper-sha256:7052692530ca4df7dd2cc86079c94bcefccb847d12784fb67a9442ad5c5869ac; blake3-1.8.7-f3149ec", "result_digest": null}
    ]
  }
}
