{
  "format_version": 0,
  "id": "state.transfer-reward.devnet-001",
  "kind": "account_state_transition",
  "status": "independently_verified",
  "description": "One regular transfer followed by reward credit to the sender/miner, including the collected fee exactly once.",
  "spec_refs": ["docs/state-model-v0.md#4-nonce-and-regular-transaction-transition", "docs/state-model-v0.md#5-block-transition-and-reward"],
  "parameters": {"P_MAX_MONEY": "2102400000000000", "P_MIN_CONSENSUS_FEE": 0},
  "inputs": {
    "sender_recipient_hex": "0003a107bff3ce10be1d70dd18e74bc09967e4d6309ba50d5f1ddc8664125531b8",
    "recipient_recipient_hex": "0029acbae141bccaf0b22e1a94d34d0bc7361e526d0bfe12c89794bc9322966dd7",
    "pre_accounts": [
      {"recipient_hex": "0003a107bff3ce10be1d70dd18e74bc09967e4d6309ba50d5f1ddc8664125531b8", "balance": 1000000000, "nonce": 0}
    ],
    "transaction": {"nonce": 0, "amount": 123456789, "fee": 1000},
    "reward": {"height": 1, "subsidy": 500000000, "fees": 1000, "recipient_hex": "0003a107bff3ce10be1d70dd18e74bc09967e4d6309ba50d5f1ddc8664125531b8"},
    "transition_order": "regular debit and nonce increment; regular credit; reward subsidy plus total fees"
  },
  "expected": {
    "fee_total": {"encoding": "integer", "value": 1000, "verification": "independently_verified"},
    "post_accounts": {"encoding": "object", "value": [
      {"recipient_hex": "0003a107bff3ce10be1d70dd18e74bc09967e4d6309ba50d5f1ddc8664125531b8", "balance": 1376543211, "nonce": 1},
      {"recipient_hex": "0029acbae141bccaf0b22e1a94d34d0bc7361e526d0bfe12c89794bc9322966dd7", "balance": 123456789, "nonce": 0}
    ], "verification": "independently_verified"},
    "pre_state_root_hex": {"encoding": "hex", "value": "91fecb92cdd12bface4cfcba7ca13031d192bb8e641dd728469b50ec38d52043", "verification": "independently_verified"},
    "post_state_root_hex": {"encoding": "hex", "value": "25484208231a78f132d97102067e49ddd3bf1fe904212116af2af81fa47923aa", "verification": "independently_verified"}
  },
  "verification": {
    "method": "Python and C checked-transition functions independently computed debit, credit, nonce, reward/fee credit, and sparse roots from the pre-state.",
    "implementations": [
      {"name": "out_ref.py", "language": "Python", "version": "sha256:b9874f21ebf3ef727e7733c1dff5d33f5da2239e73fafdf86eb6f85b631cdf73", "result_digest": "21528d5476ab75154427117b34d65d82ce73bb1e981489619e039cdf02c78ae6"},
      {"name": "out_vectors.c", "language": "C", "version": "sha256:484129ff7cac67ffbfe5e9b738852b4e12dfef59abd36a0059241c7cd16c3f52", "result_digest": "21528d5476ab75154427117b34d65d82ce73bb1e981489619e039cdf02c78ae6"}
    ]
  }
}
