{
  "format_version": 0,
  "id": "tx.id.devnet-001",
  "kind": "transaction_id",
  "status": "independently_verified",
  "description": "Transaction identifier over the complete canonical signed envelope.",
  "spec_refs": ["docs/consensus-v0.md#32-context-registry-and-exact-materials"],
  "inputs": {
    "context_ascii": "OUT Consensus v0 2026-08-30 transaction identifier",
    "canonical_transaction_hex": "0000000000bc0000fb2651b3fba992e8836d846280745eb7a21d4962d4306858bbfb42690bde49c400000003baa26e3bdda0a7b3196e89367f32a9d05558ea5ea196875f30880f055e5226a70003a107bff3ce10be1d70dd18e74bc09967e4d6309ba50d5f1ddc8664125531b800000000000000000029acbae141bccaf0b22e1a94d34d0bc7361e526d0bfe12c89794bc9322966dd700000000075bcd1500000000000003e8000000000000000100000000000003e8000a4f555420766563746f720062000003a107bff3ce10be1d70dd18e74bc09967e4d6309ba50d5f1ddc8664125531b84db0b309e83e23461a59160d12f3a37386b6a4487fc1c0e0686ed031ba34a001bf24e6a71333e0a4f4df223d388623b0ec8b07ebc79ad9d67aecb4c52981ec0b"
  },
  "expected": {
    "transaction_id_hex": {"encoding": "hex", "value": "8f027a546e612be5185e6ed78932f3b7f0f14749e6d9ec1c378144c4343a9c13", "verification": "independently_verified"}
  },
  "verification": {
    "method": "Independent Python and C encoders hashed identical complete signed bytes using the exact transaction-ID derive-key context.",
    "implementations": [
      {"name": "out_ref.py", "language": "Python", "version": "sha256:b9874f21ebf3ef727e7733c1dff5d33f5da2239e73fafdf86eb6f85b631cdf73", "result_digest": "21528d5476ab75154427117b34d65d82ce73bb1e981489619e039cdf02c78ae6"},
      {"name": "out_vectors.c plus official BLAKE3 C", "language": "C", "version": "sha256:484129ff7cac67ffbfe5e9b738852b4e12dfef59abd36a0059241c7cd16c3f52; blake3-1.8.7-f3149ec", "result_digest": "21528d5476ab75154427117b34d65d82ce73bb1e981489619e039cdf02c78ae6"}
    ]
  }
}
